{
  "schema_version": "IIOS-COMPANY-EVIDENCE-INTAKE-MANIFEST-0.1",
  "case_id": "RC-CN-A-605016-20261009",
  "market": "CN-A",
  "symbol": "605016",
  "cutoff_date": "2026-10-09",
  "sources": [
    {
      "source_id": "SSE-H1-2026-FULL",
      "field_group": "security_identity",
      "source_ref": "SSE:COMPANY_ANNOUNCEMENT",
      "source_class": "OFFICIAL_EXCHANGE",
      "url": "https://static.sse.com.cn/disclosure/listedinfo/announcement/c/new/2026-08-31/605016_20260831_CM3F.pdf",
      "known_at": "2026-08-31",
      "known_at_basis": "Candidate date from SSE archive path/public event index; not independently established as exact first-public timestamp.",
      "published_at": "2026-08-31",
      "observation_date": "2026-06-30",
      "license_status": "PUBLIC_ACCESS_REUSE_UNKNOWN"
    },
    {
      "source_id": "SINA-2025-ANNUAL-REPORT",
      "field_group": "financial_reality",
      "source_ref": "SINA:PUBLIC_DISCLOSURE_MIRROR",
      "source_class": "PUBLIC_SECONDARY",
      "url": "https://money.finance.sina.com.cn/corp/view/vCB_AllBulletinDetail.php?id=12066477&stockid=605016",
      "known_at": "2026-04-08",
      "known_at_basis": "Secondary public bulletin listing dates this annual report 2026-04-08; bytes are not issuer-origin originals.",
      "published_at": "2026-04-08",
      "observation_date": "2025-12-31",
      "license_status": "PUBLIC_ACCESS_REUSE_UNKNOWN"
    },
    {
      "source_id": "SSE-Q1-2026-FULL",
      "field_group": "financial_reality",
      "source_ref": "SSE:COMPANY_ANNOUNCEMENT",
      "source_class": "OFFICIAL_EXCHANGE",
      "url": "https://static.sse.com.cn/disclosure/listedinfo/announcement/c/new/2026-04-30/605016_20260430_JRPF.pdf",
      "known_at": "2026-04-30",
      "known_at_basis": "Candidate date from SSE archive path/public index; first-public timestamp is not independently verified.",
      "published_at": "2026-04-30",
      "observation_date": "2026-03-31",
      "license_status": "PUBLIC_ACCESS_REUSE_UNKNOWN"
    },
    {
      "source_id": "SSE-H1-OPERATING-DATA-2026",
      "field_group": "business_reality",
      "source_ref": "SSE:COMPANY_ANNOUNCEMENT",
      "source_class": "OFFICIAL_EXCHANGE",
      "url": "https://static.sse.com.cn/disclosure/listedinfo/announcement/c/new/2026-08-31/605016_20260831_1LZA.pdf",
      "known_at": "2026-08-31",
      "known_at_basis": "Candidate date from SSE archive path/public index; claims must be checked against captured original bytes.",
      "published_at": "2026-08-31",
      "observation_date": "2026-06-30",
      "license_status": "PUBLIC_ACCESS_REUSE_UNKNOWN"
    },
    {
      "source_id": "SSE-2026-09-SUBSIDIARY-INVESTMENT",
      "field_group": "business_reality",
      "source_ref": "SSE:COMPANY_ANNOUNCEMENT",
      "source_class": "OFFICIAL_EXCHANGE",
      "url": "https://static.sse.com.cn/disclosure/listedinfo/announcement/c/new/2026-09-10/605016_20260910_G7QR.pdf",
      "known_at": "2026-09-10",
      "known_at_basis": "Candidate date from SSE archive path/public index; announcement text and timestamp require captured-byte verification.",
      "published_at": "2026-09-10",
      "license_status": "PUBLIC_ACCESS_REUSE_UNKNOWN"
    },
    {
      "source_id": "SSE-2026-10-09-SHAREHOLDERS-MEETING",
      "field_group": "corporate_disclosures",
      "source_ref": "SSE:COMPANY_ANNOUNCEMENT",
      "source_class": "OFFICIAL_EXCHANGE",
      "url": "https://static.sse.com.cn/disclosure/listedinfo/announcement/c/new/2026-10-09/605016_20261009_68UA.pdf",
      "known_at": "2026-10-09",
      "known_at_basis": "Candidate archive/public index date. Keep first-public timestamp and vote claims pending raw-byte/origin verification.",
      "published_at": "2026-10-09",
      "observation_date": "2026-10-08",
      "license_status": "PUBLIC_ACCESS_REUSE_UNKNOWN"
    },
    {
      "source_id": "SSE-2026-09-CONVERTIBLE-BOND-UPDATE",
      "field_group": "capital_structure",
      "source_ref": "SSE:COMPANY_ANNOUNCEMENT",
      "source_class": "OFFICIAL_EXCHANGE",
      "url": "https://static.sse.com.cn/disclosure/listedinfo/announcement/c/new/2026-09-11/605016_20260911_B759.pdf",
      "known_at": "2026-09-11",
      "known_at_basis": "Candidate archive/public index date; bond terms and status require inspection of exact captured bytes.",
      "published_at": "2026-09-11",
      "license_status": "PUBLIC_ACCESS_REUSE_UNKNOWN"
    },
    {
      "source_id": "SSE-2026-CONVERTIBLE-BOND-PROSPECTUS",
      "field_group": "capital_structure",
      "source_ref": "SSE:COMPANY_ANNOUNCEMENT",
      "source_class": "OFFICIAL_EXCHANGE",
      "url": "https://static.sse.com.cn/stock/disclosure/announcement/c/202604/605016_20260430_ZKLC.pdf",
      "known_at": "2026-04-30",
      "known_at_basis": "SSE-hosted document surfaced from exchange-domain search; confirm document identity/status from captured bytes.",
      "published_at": "2026-04-30",
      "license_status": "PUBLIC_ACCESS_REUSE_UNKNOWN"
    },
    {
      "source_id": "SSE-2026-H1-DIVIDEND-PLAN",
      "field_group": "capital_structure",
      "source_ref": "SSE:COMPANY_ANNOUNCEMENT",
      "source_class": "OFFICIAL_EXCHANGE",
      "url": "https://static.sse.com.cn/disclosure/listedinfo/announcement/c/new/2026-08-31/605016_20260831_T6IL.pdf",
      "known_at": "2026-08-31",
      "known_at_basis": "Candidate archive/public index date; verify amount/share base/timing from the captured original.",
      "published_at": "2026-08-31",
      "license_status": "PUBLIC_ACCESS_REUSE_UNKNOWN"
    },
    {
      "source_id": "SSE-2026-07-PLEDGE-RELEASE",
      "field_group": "trust_governance_events",
      "source_ref": "SSE:COMPANY_ANNOUNCEMENT",
      "source_class": "OFFICIAL_EXCHANGE",
      "url": "https://static.sse.com.cn/disclosure/listedinfo/announcement/c/new/2026-07-24/605016_20260724_7ZUA.pdf",
      "known_at": "2026-07-24",
      "known_at_basis": "Candidate archive/public index date; pledged-share scope must be extracted from captured original.",
      "published_at": "2026-07-24",
      "license_status": "PUBLIC_ACCESS_REUSE_UNKNOWN"
    },
    {
      "source_id": "PRICE-STOCKSTAR-2026-10-09",
      "field_group": "market_price",
      "source_ref": "STOCKSTAR:MARKET_PRICE_ARTICLE",
      "source_class": "PUBLIC_SECONDARY",
      "url": "https://wap.stockstar.com/detail/RB2026100900029140",
      "known_at": "2026-10-09T18:09:28+08:00",
      "known_at_basis": "Search result shows publication time 2026-10-09 18:09:28; secondary price claim still requires exact-byte replay and source-origin adjudication.",
      "published_at": "2026-10-09T18:09:28+08:00",
      "observation_date": "2026-10-09",
      "license_status": "PUBLIC_ACCESS_REUSE_UNKNOWN"
    },
    {
      "source_id": "PRICE-SOHU-HISTORY-2026-10-09",
      "field_group": "market_price",
      "source_ref": "SOHU:MARKET_HISTORY_PAGE",
      "source_class": "PUBLIC_SECONDARY",
      "url": "https://q.stock.sohu.com/cn/605016/lshq.shtml",
      "known_at": "",
      "known_at_basis": "",
      "published_at": "",
      "observation_date": "2026-10-09",
      "license_status": "PUBLIC_ACCESS_REUSE_UNKNOWN"
    }
  ]
}
