{
  "schema_version": "IIOS-COMPANY-EVIDENCE-INTAKE-MANIFEST-0.1",
  "case_id": "RC-CN-A-002001-20261009",
  "market": "CN-A",
  "symbol": "002001",
  "cutoff_date": "2026-10-09",
  "sources": [
    {
      "source_id": "ISSUER-IR-PAGE-CURRENT",
      "field_group": "security_identity",
      "source_ref": "ISSUER:INVESTOR_RELATIONS_PUBLIC",
      "source_class": "ISSUER_PRIMARY",
      "url": "https://www.cnhu.com/investor/zh-cn",
      "known_at": "",
      "known_at_basis": "",
      "published_at": "",
      "license_status": "PUBLIC_ACCESS_REUSE_UNKNOWN"
    },
    {
      "source_id": "SZSE-2026-H1-FULL",
      "field_group": "financial_reality",
      "source_ref": "SZSE:COMPANY_ANNOUNCEMENT",
      "source_class": "OFFICIAL_EXCHANGE",
      "url": "https://disc.static.szse.cn/disc/disk03/finalpage/2026-08-20/83165436-1015-4d77-919c-97c8cce0c67d.PDF",
      "known_at": "2026-08-20",
      "known_at_basis": "SZSE-hosted source path and exchange-indexed document identify publication date 2026-08-20; exact first-public timestamp and date basis remain subject to existing B2 Evidence/PIT admission review.",
      "published_at": "2026-08-20",
      "observation_date": "2026-06-30",
      "license_status": "PUBLIC_ACCESS_REUSE_UNKNOWN"
    },
    {
      "source_id": "SZSE-2026-H1-SUMMARY",
      "field_group": "corporate_disclosures",
      "source_ref": "SZSE:COMPANY_ANNOUNCEMENT",
      "source_class": "OFFICIAL_EXCHANGE",
      "url": "https://disc.static.szse.cn/disc/disk03/finalpage/2026-08-20/6d1ad0be-5e22-482b-a163-2ebb0b6d1d95.PDF",
      "known_at": "2026-08-20",
      "known_at_basis": "SZSE-hosted source path and exchange-indexed summary identify publication date 2026-08-20; exact first-public timestamp and date basis remain subject to existing B2 Evidence/PIT admission review.",
      "published_at": "2026-08-20",
      "observation_date": "2026-06-30",
      "license_status": "PUBLIC_ACCESS_REUSE_UNKNOWN"
    },
    {
      "source_id": "SZSE-2026-Q1-FULL",
      "field_group": "financial_reality",
      "source_ref": "SZSE:COMPANY_ANNOUNCEMENT",
      "source_class": "OFFICIAL_EXCHANGE",
      "url": "https://disc.static.szse.cn/download/disc/disk03/finalpage/2026-04-29/094c9e5d-f2de-4411-b604-b2aece32f35b.PDF",
      "known_at": "2026-04-29",
      "known_at_basis": "SZSE-hosted source path and exchange-indexed report identify publication date 2026-04-29; exact first-public timestamp and date basis remain subject to existing B2 Evidence/PIT admission review.",
      "published_at": "2026-04-29",
      "observation_date": "2026-03-31",
      "license_status": "PUBLIC_ACCESS_REUSE_UNKNOWN"
    },
    {
      "source_id": "SZSE-2026-BUYBACK-PLAN",
      "field_group": "trust_governance_events",
      "source_ref": "SZSE:COMPANY_ANNOUNCEMENT",
      "source_class": "OFFICIAL_EXCHANGE",
      "url": "https://disc.static.szse.cn/download/disc/disk03/finalpage/2026-06-24/53248225-c2cf-45cf-a0fd-a6c9fee4f267.PDF",
      "known_at": "2026-06-24",
      "known_at_basis": "SZSE-hosted source path and exchange announcement number identify publication date as 2026-06-24; exact first-public timestamp remains subject to independent B2 Evidence/PIT admission review.",
      "published_at": "2026-06-24",
      "license_status": "PUBLIC_ACCESS_REUSE_UNKNOWN"
    },
    {
      "source_id": "SZSE-2026-BUYBACK-PROGRESS-SEP",
      "field_group": "capital_structure",
      "source_ref": "SZSE:COMPANY_ANNOUNCEMENT",
      "source_class": "OFFICIAL_EXCHANGE",
      "url": "https://disc.static.szse.cn/download/disc/disk03/finalpage/2026-10-09/abbcbfb7-92cb-4e05-a838-aff78aaa8077.PDF",
      "known_at": "2026-10-09",
      "known_at_basis": "Public web discovery returned this direct HTTPS PDF under the official SZSE static domain; document title/content and exact publication time must still be checked from the captured bytes and by B2 Evidence/PIT admission.",
      "published_at": "2026-10-09",
      "observation_date": "2026-09-30",
      "license_status": "PUBLIC_ACCESS_REUSE_UNKNOWN"
    },
    {
      "source_id": "PRICE-SOHU-HISTORY",
      "field_group": "market_price",
      "source_ref": "SOHU:PUBLIC_MARKET_HISTORY",
      "source_class": "PUBLIC_SECONDARY",
      "url": "https://q.stock.sohu.com/cn/002001/lshq.shtml",
      "known_at": "",
      "known_at_basis": "",
      "published_at": "",
      "observation_date": "2026-10-09",
      "license_status": "PUBLIC_ACCESS_REUSE_UNKNOWN"
    },
    {
      "source_id": "PRICE-EASTMONEY-QUOTE",
      "field_group": "market_price",
      "source_ref": "EASTMONEY:PUBLIC_MARKET_QUOTE",
      "source_class": "PUBLIC_SECONDARY",
      "url": "https://quote.eastmoney.com/sz002001.html",
      "known_at": "",
      "known_at_basis": "",
      "published_at": "",
      "observation_date": "2026-10-09",
      "license_status": "PUBLIC_ACCESS_REUSE_UNKNOWN"
    },
    {
      "source_id": "PRICE-EASTMONEY-KLINE-API",
      "field_group": "market_price",
      "source_ref": "EASTMONEY:PUBLIC_HISTORICAL_KLINE_API",
      "source_class": "PUBLIC_SECONDARY",
      "url": "https://push2his.eastmoney.com/api/qt/stock/kline/get?secid=0.002001&fields1=f1%2Cf2%2Cf3%2Cf4%2Cf5%2Cf6&fields2=f51%2Cf52%2Cf53%2Cf54%2Cf55%2Cf56%2Cf57%2Cf58%2Cf59%2Cf60%2Cf61&klt=101&fqt=0&beg=20261009&end=20261010",
      "known_at": "",
      "known_at_basis": "",
      "published_at": "",
      "observation_date": "2026-10-09",
      "license_status": "PUBLIC_ACCESS_REUSE_UNKNOWN"
    }
  ]
}
